{
  "cases": [
    {
      "cost": {
        "estimated_tokens": 283,
        "model_calls": 1
      },
      "id": "wiki-fair-v2-test-37040882",
      "mentions": [
        {
          "end": 12,
          "key": "Q17403146",
          "label": "Thelma Young",
          "start": 0,
          "type": "entity"
        },
        {
          "end": 26,
          "key": "Q17403146",
          "label": "Thelma Young",
          "start": 14,
          "type": "entity"
        },
        {
          "end": 93,
          "key": "Q23666",
          "label": "Great Britain",
          "start": 80,
          "type": "entity"
        },
        {
          "end": 385,
          "key": "Q16919374",
          "label": "City of Southampton Swimming Club",
          "start": 352,
          "type": "entity"
        },
        {
          "end": 477,
          "key": "Q628099",
          "label": "Coach",
          "start": 472,
          "type": "entity"
        },
        {
          "end": 515,
          "key": "Q628099",
          "label": "Coach",
          "start": 510,
          "type": "entity"
        },
        {
          "end": 695,
          "key": "Q90",
          "label": "Paris",
          "start": 690,
          "type": "entity"
        },
        {
          "end": 703,
          "key": "Q142",
          "label": "France",
          "start": 697,
          "type": "entity"
        },
        {
          "end": 721,
          "key": "Q208045",
          "label": "gold",
          "start": 717,
          "type": "entity"
        },
        {
          "end": 815,
          "key": "Q208045",
          "label": "gold",
          "start": 811,
          "type": "entity"
        },
        {
          "end": 1119,
          "key": "Q208045",
          "label": "gold",
          "start": 1115,
          "type": "entity"
        },
        {
          "end": 1194,
          "key": "Q406039",
          "label": "gold medal",
          "start": 1184,
          "type": "entity"
        },
        {
          "end": 1279,
          "key": "Q55",
          "label": "Netherlands",
          "start": 1268,
          "type": "entity"
        },
        {
          "end": 1336,
          "key": "Q208045",
          "label": "gold",
          "start": 1332,
          "type": "entity"
        },
        {
          "end": 1445,
          "key": "Q787674",
          "label": "Bachelor of Science",
          "start": 1426,
          "type": "entity"
        },
        {
          "end": 1652,
          "key": "Q31920",
          "label": "swimming",
          "start": 1644,
          "type": "entity"
        },
        {
          "end": 1797,
          "key": "Q31920",
          "label": "swimming",
          "start": 1789,
          "type": "entity"
        },
        {
          "end": 1916,
          "key": "Q31920",
          "label": "Swimming",
          "start": 1908,
          "type": "entity"
        },
        {
          "end": 1935,
          "key": "Q1313",
          "label": "Summer",
          "start": 1929,
          "type": "entity"
        }
      ]
    },
    {
      "cost": {
        "estimated_tokens": 124,
        "model_calls": 1
      },
      "id": "wiki-fair-v2-test-61951348",
      "mentions": [
        {
          "end": 14,
          "key": "Q26720335",
          "label": "Sameli Ventelä",
          "start": 0,
          "type": "entity"
        },
        {
          "end": 30,
          "key": "Q26720335",
          "label": "Sameli Ventelä",
          "start": 16,
          "type": "entity"
        },
        {
          "end": 88,
          "key": "Q41466",
          "label": "ice hockey",
          "start": 78,
          "type": "entity"
        },
        {
          "end": 189,
          "key": "Q5038893",
          "label": "career",
          "start": 183,
          "type": "entity"
        },
        {
          "end": 198,
          "key": "Q1474502",
          "label": "HPK",
          "start": 195,
          "type": "entity"
        },
        {
          "end": 273,
          "key": "Q25379",
          "label": "play",
          "start": 269,
          "type": "entity"
        },
        {
          "end": 316,
          "key": "Q1740443",
          "label": "SaPKo",
          "start": 311,
          "type": "entity"
        },
        {
          "end": 326,
          "key": "Q750918",
          "label": "Mestis",
          "start": 320,
          "type": "entity"
        },
        {
          "end": 433,
          "key": "Q1474497",
          "label": "Lukko",
          "start": 428,
          "type": "entity"
        },
        {
          "end": 487,
          "key": "Q23045120",
          "label": "2016–17 Liiga season",
          "start": 467,
          "type": "entity"
        },
        {
          "end": 558,
          "key": "Q750918",
          "label": "Mestis",
          "start": 552,
          "type": "entity"
        },
        {
          "end": 621,
          "key": "Q23051084",
          "label": "2018",
          "start": 617,
          "type": "entity"
        },
        {
          "end": 693,
          "key": "Q214",
          "label": "Slovakia",
          "start": 685,
          "type": "entity"
        }
      ]
    },
    {
      "cost": {
        "estimated_tokens": 4409,
        "model_calls": 1
      },
      "id": "wiki-fair-v2-test-2000128",
      "mentions": [
        {
          "end": 2430,
          "key": "Q3400985",
          "label": "academics",
          "start": 2421,
          "type": "entity"
        },
        {
          "end": 7089,
          "key": "Q10870555",
          "label": "report",
          "start": 7083,
          "type": "entity"
        },
        {
          "end": 7156,
          "key": "Q30",
          "label": "American",
          "start": 7148,
          "type": "entity"
        },
        {
          "end": 9024,
          "key": "Q18554460",
          "label": "unknown",
          "start": 9017,
          "type": "entity"
        },
        {
          "end": 10095,
          "key": "Q876720",
          "label": "via",
          "start": 10092,
          "type": "entity"
        },
        {
          "end": 10284,
          "key": "Q876720",
          "label": "via",
          "start": 10281,
          "type": "entity"
        },
        {
          "end": 11253,
          "key": "Q37226",
          "label": "teacher",
          "start": 11246,
          "type": "entity"
        },
        {
          "end": 12311,
          "key": "Q876720",
          "label": "via",
          "start": 12308,
          "type": "entity"
        },
        {
          "end": 13393,
          "key": "Q25379",
          "label": "play",
          "start": 13389,
          "type": "entity"
        },
        {
          "end": 14070,
          "key": "Q48282",
          "label": "student",
          "start": 14063,
          "type": "entity"
        },
        {
          "end": 14148,
          "key": "Q148",
          "label": "China",
          "start": 14143,
          "type": "entity"
        },
        {
          "end": 15897,
          "key": "Q11661",
          "label": "information technology",
          "start": 15875,
          "type": "entity"
        },
        {
          "end": 18101,
          "key": "Q25379",
          "label": "play",
          "start": 18097,
          "type": "entity"
        },
        {
          "end": 18388,
          "key": "Q160381",
          "label": "Western",
          "start": 18381,
          "type": "entity"
        },
        {
          "end": 20670,
          "key": "Q918",
          "label": "Twitter",
          "start": 20663,
          "type": "entity"
        },
        {
          "end": 24376,
          "key": "Q92747",
          "label": "Eric Schmidt",
          "start": 24364,
          "type": "entity"
        },
        {
          "end": 24391,
          "key": "Q95",
          "label": "Google",
          "start": 24385,
          "type": "entity"
        },
        {
          "end": 24420,
          "key": "Q356",
          "label": "Google+",
          "start": 24413,
          "type": "entity"
        },
        {
          "end": 24525,
          "key": "Q356",
          "label": "Google+",
          "start": 24518,
          "type": "entity"
        },
        {
          "end": 26136,
          "key": "Q13974",
          "label": "NBC",
          "start": 26133,
          "type": "entity"
        },
        {
          "end": 26464,
          "key": "Q13974",
          "label": "NBC",
          "start": 26461,
          "type": "entity"
        }
      ]
    },
    {
      "cost": {
        "estimated_tokens": 185,
        "model_calls": 1
      },
      "id": "wiki-fair-v2-test-61494965",
      "mentions": [
        {
          "end": 20,
          "key": "Q1162635",
          "label": "SKIF Nizhny Novgorod",
          "start": 0,
          "type": "entity"
        },
        {
          "end": 42,
          "key": "Q1162635",
          "label": "SKIF Nizhny Novgorod",
          "start": 22,
          "type": "entity"
        },
        {
          "end": 105,
          "key": "Q159",
          "label": "Russian",
          "start": 98,
          "type": "entity"
        },
        {
          "end": 124,
          "key": "Q41466",
          "label": "ice hockey",
          "start": 114,
          "type": "entity"
        },
        {
          "end": 154,
          "key": "Q891",
          "label": "Nizhny Novgorod",
          "start": 139,
          "type": "entity"
        },
        {
          "end": 162,
          "key": "Q159",
          "label": "Russia",
          "start": 156,
          "type": "entity"
        },
        {
          "end": 255,
          "key": "Q41466",
          "label": "ice hockey",
          "start": 245,
          "type": "entity"
        },
        {
          "end": 265,
          "key": "Q159",
          "label": "Russia",